<?xml version="1.0" encoding="UTF-8"?>
<xs:schema xmlns:xs="http://www.w3.org/2001/XMLSchema">

    <xs:element name="employees">
        <xs:complexType>
            <xs:sequence>
                <xs:element name="employee" maxOccurs="unbounded">
                    <xs:complexType>
                        <xs:sequence>
                            <xs:element name="name" type="xs:string"/>
                            <xs:element name="surname" type="xs:string"/>
                            <xs:element name="age" type="xs:int"/>
                            <xs:element name="salary" type="xs:double"/>
                        </xs:sequence>
                        <xs:attribute name="employee_code" type="xs:string" use="required"/>
                        <xs:attribute name="category" type="xs:string" use="required"/>
                    </xs:complexType>
                </xs:element>
            </xs:sequence>
        </xs:complexType>
    </xs:element>

</xs:schema>

